{
  "$schema": "https://json-schema.org/draft/2020-12/schema",
  "$id": "https://landmark.dev/schemas/release-entry.v1.schema.json",
  "title": "Landmark release entry",
  "type": "object",
  "additionalProperties": false,
  "x-landmark-artifact": "release notes JSON entry",
  "required": [
    "version",
    "tag",
    "notes",
    "markdown",
    "html",
    "plaintext",
    "slack",
    "sections",
    "published_at"
  ],
  "properties": {
    "schema_version": {
      "type": "string",
      "const": "landmark.public-release-notes.v1"
    },
    "version": { "type": "string" },
    "tag": { "type": "string" },
    "repository": { "type": "string" },
    "release_url": { "type": "string" },
    "audience": { "type": "string" },
    "notes": { "type": "string" },
    "markdown": { "type": "string" },
    "html": { "type": "string" },
    "plaintext": { "type": "string" },
    "slack": { "type": "string" },
    "published_at": { "type": "string" },
    "sections": {
      "type": "array",
      "items": {
        "type": "object",
        "required": ["title", "bullets"],
        "properties": {
          "title": { "type": "string" },
          "bullets": {
            "type": "array",
            "items": {
              "type": "object",
              "required": ["text", "links"],
              "properties": {
                "text": { "type": "string" },
                "links": {
                  "type": "array",
                  "items": {
                    "type": "object",
                    "required": ["label", "href"],
                    "properties": {
                      "label": { "type": "string" },
                      "href": { "type": "string" }
                    },
                    "additionalProperties": false
                  }
                }
              },
              "additionalProperties": false
            }
          }
        },
        "additionalProperties": false
      }
    }
  }
}
